{
  "content_policy": {
    "sidecar_contains_cloud_storage_locations": false,
    "sidecar_contains_provider_account_identifiers": false,
    "sidecar_contains_verbatim_text": false,
    "verbatim_text_location": "ignored_private_capture_only"
  },
  "extraction_provenance": {
    "generator": "transcripts.sidecar",
    "generator_version": "1.0.0",
    "importer": "aws_transcribe"
  },
  "job_configuration": {
    "alternative_results": false,
    "audio_identification": false,
    "channel_identification": false,
    "custom_vocabulary": null,
    "media_format": "mp3",
    "media_sample_rate_hz": 44100,
    "pii_redaction": false,
    "speaker_labels": false,
    "toxicity_detection": false,
    "vocabulary_filter": null
  },
  "job_timing": {
    "completed_at": "2026-09-03T18:45:17",
    "created_at": "2026-09-03T18:45:03",
    "started_at": "2026-09-03T18:45:03",
    "timezone": "unknown"
  },
  "raw_transcript": {
    "filename": "TheLighthouse_Meditate_GuidedMeditation_Atmospheric_11.5_120bpm_HighNEL_Nrmlzd2_VBR5.json",
    "format": "aws_transcribe_json",
    "hash_algorithm": "sha256",
    "sha256": "8cd11a36915b40db3da8cb20e2be42ffa9becdeb76e2b0f469a95612fce4df85",
    "size_bytes": 78736,
    "storage_policy": "ignored_private_capture",
    "verbatim_content_sha256": "0b6f1a34c6a2f3147d10774772d00f689554b6e2d2ab2cd19dfb40aa3bd3dd75"
  },
  "recording": {
    "duration_seconds": 690.0,
    "filename": "TheLighthouse_Meditate_GuidedMeditation_Atmospheric_11.5_120bpm_HighNEL_Nrmlzd2_VBR5.mp3",
    "hash_algorithm": "sha256",
    "sha256": "13d21f376026fc0bed25ab5843c0173cea7f4aca7a206905fa4565b8e495a62f",
    "size_bytes": 9856324
  },
  "speech_timeline": {
    "pronunciation_items": [
      {
        "confidence": 0.999,
        "end_seconds": 1.83,
        "item_id": 0,
        "start_seconds": 1.36
      },
      {
        "confidence": 0.991,
        "end_seconds": 1.99,
        "item_id": 1,
        "start_seconds": 1.83
      },
      {
        "confidence": 0.998,
        "end_seconds": 2.27,
        "item_id": 2,
        "start_seconds": 1.99
      },
      {
        "confidence": 0.998,
        "end_seconds": 2.87,
        "item_id": 3,
        "start_seconds": 2.27
      },
      {
        "confidence": 0.994,
        "end_seconds": 3.59,
        "item_id": 4,
        "start_seconds": 2.87
      },
      {
        "confidence": 1.0,
        "end_seconds": 44.68,
        "item_id": 6,
        "start_seconds": 44.49
      },
      {
        "confidence": 0.998,
        "end_seconds": 44.92,
        "item_id": 7,
        "start_seconds": 44.68
      },
      {
        "confidence": 0.997,
        "end_seconds": 45.44,
        "item_id": 8,
        "start_seconds": 44.92
      },
      {
        "confidence": 0.982,
        "end_seconds": 46.64,
        "item_id": 9,
        "start_seconds": 45.44
      },
      {
        "confidence": 0.989,
        "end_seconds": 47.16,
        "item_id": 11,
        "start_seconds": 46.97
      },
      {
        "confidence": 0.998,
        "end_seconds": 47.36,
        "item_id": 12,
        "start_seconds": 47.16
      },
      {
        "confidence": 0.963,
        "end_seconds": 47.87,
        "item_id": 13,
        "start_seconds": 47.36
      },
      {
        "confidence": 0.998,
        "end_seconds": 48.12,
        "item_id": 14,
        "start_seconds": 47.93
      },
      {
        "confidence": 0.984,
        "end_seconds": 48.72,
        "item_id": 15,
        "start_seconds": 48.12
      },
      {
        "confidence": 0.987,
        "end_seconds": 49.68,
        "item_id": 16,
        "start_seconds": 48.72
      },
      {
        "confidence": 0.998,
        "end_seconds": 50.59,
        "item_id": 17,
        "start_seconds": 49.92
      },
      {
        "confidence": 0.998,
        "end_seconds": 50.84,
        "item_id": 18,
        "start_seconds": 50.61
      },
      {
        "confidence": 0.983,
        "end_seconds": 51.24,
        "item_id": 19,
        "start_seconds": 50.84
      },
      {
        "confidence": 0.998,
        "end_seconds": 53.04,
        "item_id": 21,
        "start_seconds": 52.77
      },
      {
        "confidence": 0.998,
        "end_seconds": 53.28,
        "item_id": 22,
        "start_seconds": 53.04
      },
      {
        "confidence": 0.992,
        "end_seconds": 53.72,
        "item_id": 23,
        "start_seconds": 53.28
      },
      {
        "confidence": 0.987,
        "end_seconds": 54.6,
        "item_id": 24,
        "start_seconds": 53.72
      },
      {
        "confidence": 0.991,
        "end_seconds": 55.4,
        "item_id": 25,
        "start_seconds": 55.05
      },
      {
        "confidence": 0.976,
        "end_seconds": 55.72,
        "item_id": 26,
        "start_seconds": 55.4
      },
      {
        "confidence": 0.998,
        "end_seconds": 55.99,
        "item_id": 27,
        "start_seconds": 55.72
      },
      {
        "confidence": 0.991,
        "end_seconds": 56.64,
        "item_id": 28,
        "start_seconds": 56.01
      },
      {
        "confidence": 0.994,
        "end_seconds": 64.25,
        "item_id": 30,
        "start_seconds": 64.1
      },
      {
        "confidence": 0.998,
        "end_seconds": 64.49,
        "item_id": 31,
        "start_seconds": 64.25
      },
      {
        "confidence": 0.969,
        "end_seconds": 64.76,
        "item_id": 32,
        "start_seconds": 64.49
      },
      {
        "confidence": 0.965,
        "end_seconds": 65.54,
        "item_id": 33,
        "start_seconds": 65.06
      },
      {
        "confidence": 0.996,
        "end_seconds": 66.01,
        "item_id": 34,
        "start_seconds": 65.54
      },
      {
        "confidence": 0.999,
        "end_seconds": 67.41,
        "item_id": 36,
        "start_seconds": 67.06
      },
      {
        "confidence": 0.999,
        "end_seconds": 67.62,
        "item_id": 37,
        "start_seconds": 67.43
      },
      {
        "confidence": 0.991,
        "end_seconds": 68.37,
        "item_id": 38,
        "start_seconds": 67.62
      },
      {
        "confidence": 0.999,
        "end_seconds": 68.82,
        "item_id": 39,
        "start_seconds": 68.43
      },
      {
        "confidence": 0.971,
        "end_seconds": 69.09,
        "item_id": 40,
        "start_seconds": 68.82
      },
      {
        "confidence": 0.973,
        "end_seconds": 69.54,
        "item_id": 41,
        "start_seconds": 69.11
      },
      {
        "confidence": 1.0,
        "end_seconds": 74.41,
        "item_id": 43,
        "start_seconds": 74.22
      },
      {
        "confidence": 0.987,
        "end_seconds": 74.68,
        "item_id": 44,
        "start_seconds": 74.41
      },
      {
        "confidence": 0.998,
        "end_seconds": 75.76,
        "item_id": 45,
        "start_seconds": 74.7
      },
      {
        "confidence": 0.998,
        "end_seconds": 76.53,
        "item_id": 47,
        "start_seconds": 76.23
      },
      {
        "confidence": 0.998,
        "end_seconds": 76.84,
        "item_id": 48,
        "start_seconds": 76.53
      },
      {
        "confidence": 0.998,
        "end_seconds": 77.05,
        "item_id": 49,
        "start_seconds": 76.86
      },
      {
        "confidence": 0.998,
        "end_seconds": 77.57,
        "item_id": 50,
        "start_seconds": 77.05
      },
      {
        "confidence": 0.981,
        "end_seconds": 77.93,
        "item_id": 51,
        "start_seconds": 77.57
      },
      {
        "confidence": 0.998,
        "end_seconds": 78.13,
        "item_id": 52,
        "start_seconds": 77.93
      },
      {
        "confidence": 0.988,
        "end_seconds": 78.75,
        "item_id": 53,
        "start_seconds": 78.13
      },
      {
        "confidence": 0.985,
        "end_seconds": 78.97,
        "item_id": 54,
        "start_seconds": 78.75
      },
      {
        "confidence": 0.994,
        "end_seconds": 79.14,
        "item_id": 55,
        "start_seconds": 78.97
      },
      {
        "confidence": 0.998,
        "end_seconds": 79.37,
        "item_id": 56,
        "start_seconds": 79.14
      },
      {
        "confidence": 0.994,
        "end_seconds": 79.89,
        "item_id": 57,
        "start_seconds": 79.37
      },
      {
        "confidence": 0.999,
        "end_seconds": 80.13,
        "item_id": 58,
        "start_seconds": 79.89
      },
      {
        "confidence": 0.991,
        "end_seconds": 80.48,
        "item_id": 59,
        "start_seconds": 80.13
      },
      {
        "confidence": 0.998,
        "end_seconds": 86.39,
        "item_id": 61,
        "start_seconds": 85.92
      },
      {
        "confidence": 0.998,
        "end_seconds": 86.75,
        "item_id": 62,
        "start_seconds": 86.39
      },
      {
        "confidence": 0.982,
        "end_seconds": 87.31,
        "item_id": 63,
        "start_seconds": 86.75
      },
      {
        "confidence": 0.999,
        "end_seconds": 87.59,
        "item_id": 64,
        "start_seconds": 87.31
      },
      {
        "confidence": 0.994,
        "end_seconds": 87.94,
        "item_id": 65,
        "start_seconds": 87.59
      },
      {
        "confidence": 0.993,
        "end_seconds": 88.67,
        "item_id": 66,
        "start_seconds": 87.96
      },
      {
        "confidence": 0.987,
        "end_seconds": 89.55,
        "item_id": 68,
        "start_seconds": 89.0
      },
      {
        "confidence": 0.998,
        "end_seconds": 89.98,
        "item_id": 69,
        "start_seconds": 89.55
      },
      {
        "confidence": 0.978,
        "end_seconds": 90.37,
        "item_id": 70,
        "start_seconds": 89.98
      },
      {
        "confidence": 0.948,
        "end_seconds": 90.91,
        "item_id": 71,
        "start_seconds": 90.37
      },
      {
        "confidence": 0.999,
        "end_seconds": 91.47,
        "item_id": 72,